{
  "packages": [
    {
      "commit": "b4a3357404e4c4f74f1e6cb55d695cf18eacd5bf",
      "git_object_format": "sha1",
      "id": "attended-review",
      "metadata_digest": "sha256:74234e98afe7498fb5daf1f36ac2d78acc339464f950703b8c019892f982b90b",
      "path": "skills/attended-review",
      "payload_digest": "sha256:d89348747b125a092e14802d68df2acadae9319c7971c89e093b9902f263fbf2",
      "repository": "https://github.com/MikeMarcin/AgentSkills.git",
      "selector": {
        "ref": "refs/heads/main"
      },
      "source": "agentskills"
    },
    {
      "commit": "471df74a63573e679ed3a586e5dd221b86f1e4d0",
      "git_object_format": "sha1",
      "id": "author-rfc",
      "metadata_digest": "sha256:74234e98afe7498fb5daf1f36ac2d78acc339464f950703b8c019892f982b90b",
      "path": "skills/author-rfc",
      "payload_digest": "sha256:e9e655e696b389b35d1220bcfc5a226e5946be36676c7dc1826bea8419a57f28",
      "repository": "https://github.com/MikeMarcin/AgentSkills.git",
      "selector": {
        "ref": "refs/heads/main"
      },
      "source": "agentskills"
    },
    {
      "commit": "b4a3357404e4c4f74f1e6cb55d695cf18eacd5bf",
      "git_object_format": "sha1",
      "id": "grill-me",
      "metadata_digest": "sha256:74234e98afe7498fb5daf1f36ac2d78acc339464f950703b8c019892f982b90b",
      "path": "skills/grill-me",
      "payload_digest": "sha256:2f132bfd7d65193b80dfed676d1e7cf634126be02dd9682e2e6277fd12efd69e",
      "repository": "https://github.com/MikeMarcin/AgentSkills.git",
      "selector": {
        "ref": "refs/heads/main"
      },
      "source": "agentskills"
    },
    {
      "commit": "471df74a63573e679ed3a586e5dd221b86f1e4d0",
      "git_object_format": "sha1",
      "id": "grill-rfc",
      "metadata_digest": "sha256:74234e98afe7498fb5daf1f36ac2d78acc339464f950703b8c019892f982b90b",
      "path": "skills/grill-rfc",
      "payload_digest": "sha256:1e064f4ecd5552dd9114c55200a530778823677cc51e5bf750ec2e33742b15f7",
      "repository": "https://github.com/MikeMarcin/AgentSkills.git",
      "selector": {
        "ref": "refs/heads/main"
      },
      "source": "agentskills"
    },
    {
      "commit": "b75119cd7a39310407827c5275799ab25f84f39f",
      "git_object_format": "sha1",
      "id": "implement-rfc",
      "metadata_digest": "sha256:74234e98afe7498fb5daf1f36ac2d78acc339464f950703b8c019892f982b90b",
      "path": "skills/implement-rfc",
      "payload_digest": "sha256:0adaa2df297b6c87de7035056b495075f362d6a0b3192e21f02e9c6ef2abbbab",
      "repository": "https://github.com/MikeMarcin/AgentSkills.git",
      "selector": {
        "ref": "refs/heads/main"
      },
      "source": "agentskills"
    },
    {
      "commit": "5139a09a07bfaa0fb5414f1137343349463e66c2",
      "git_object_format": "sha1",
      "id": "wizard",
      "metadata_digest": "sha256:74234e98afe7498fb5daf1f36ac2d78acc339464f950703b8c019892f982b90b",
      "path": "skills/wizard",
      "payload_digest": "sha256:5367ef657d04bf848b58008bfd9767f8d9c00da323e15d98a91ce1b920c8607d",
      "repository": "https://github.com/MikeMarcin/AgentSkills.git",
      "selector": {
        "ref": "refs/heads/main"
      },
      "source": "agentskills"
    },
    {
      "commit": "5139a09a07bfaa0fb5414f1137343349463e66c2",
      "git_object_format": "sha1",
      "id": "writing-for-agents",
      "metadata_digest": "sha256:74234e98afe7498fb5daf1f36ac2d78acc339464f950703b8c019892f982b90b",
      "path": "skills/writing-for-agents",
      "payload_digest": "sha256:832d4ece515f25effbc126fe5d49d7ea3e5a07e209f7f33e970a55ffc460af8a",
      "repository": "https://github.com/MikeMarcin/AgentSkills.git",
      "selector": {
        "ref": "refs/heads/main"
      },
      "source": "agentskills"
    }
  ],
  "resolver": "mask-lock-v1",
  "schema_version": 1,
  "selection_digest": "sha256:9ff2548d0219c6666752110f88f24f5afba55b96b0043bec8b066649d50ddb29"
}
